name,year,rating,imdb_votes,run_time,genre1,genre2,budget_USD,openning_USD,gross_USD,Oscar_wins,Oscar_nominations,other_wins,other_nominations,director,cast,synopsis
Gamer,2009,5.8,133115,95,Action,Sci-Fi,64778569.66,14515272.25,52896288.45,0,0,NA,0,Mark Neveldine,"Gerard Butler,Amber Valletta,Michael C. Hall,Kyra Sedgwick,Logan Lerman","In a future mind-controlling game, death row convicts are forced to battle in a 'Doom'-type environment. Convict Kable, controlled by Simon, a skilled teenage gamer, must survive thirty sessions in order to be set free."
Straw Dogs,2011,5.8,33811,110,Action,Drama,30891486.14,6331222.44,NA,0,0,NA,2,Rod Lurie,"James Marsden,Kate Bosworth,Alexander Skarsgård,James Woods,Dominic Purcell","Los Angeles screenwriter David Sumner relocates with his wife to her hometown in the deep South. There, while tensions build between them, a brewing conflict with locals becomes a threat to them both."
The Green Hornet,2011,5.8,158660,119,Action,Comedy,148279133.5,41427801.01,281504534.3,0,0,NA,7,Michel Gondry,"Seth Rogen,Jay Chou,Cameron Diaz,Tom Wilkinson,Christoph Waltz","Following the death of his father, Britt Reid, heir to his father's large company, teams up with his late dad's assistant Kato to become a masked crime fighting team."
Brüno,2009,5.8,147213,81,Comedy,NA,54413998.52,39669268.92,179832863.9,0,0,NA,5,Larry Charles,"Sacha Baron Cohen,Gustaf Hammarsten,Clifford Bañagale,Chibundu Orukwowu,Chigozie Orukwowu",Flamboyant and gay Austrian Brüno looks for new fame in America.
Semi-Pro,2008,5.8,80791,91,Comedy,Sport,71002912.17,19461399.92,NA,0,0,NA,4,Kent Alterman,"Will Ferrell,Woody Harrelson,André 3000,Maura Tierney,Andy Daly","Jackie Moon, the owner-coach-player of the American Basketball Association's Flint Michigan Tropics, rallies his teammates to make their NBA dreams come true."
Clash of the Titans,2010,5.8,277397,106,Action,Adventure,159332923.7,78054146.48,628683094.6,0,0,NA,14,Louis Leterrier,"Sam Worthington,Liam Neeson,Ralph Fiennes,Jason Flemyng,Gemma Arterton","Perseus, a demigod and the son of Zeus, battles the minions of Hades and the Underworld in order to stop them from conquering Olympus and Earth."
Until Death,2007,5.8,9781,101,Action,Crime,16089609.26,287010.4724,NA,0,0,0,0,Simon Fellows,"Jean-Claude Van Damme,Selina Giles,Mark Dymond,William Ash,Stephen Lord","Stowe is a dirty cop who is hooked on heroin, and everyone dislikes him. Because of an accident he is put into a coma, and comes out of it a better person. He wakes up wanting to put things right."
The Wolfman,2010,5.8,105357,103,Drama,Fantasy,191199508.4,45320739.66,178184895.6,1,0,NA,8,Joe Johnston,"Simon Merrells,Gemma Whelan,Emily Blunt,Benicio Del Toro,Mario Marin-Borquez","Upon his return to his ancestral homeland, an American man is bitten, and subsequently cursed by, a werewolf."
Bobby Z,2007,5.8,14529,97,Action,Crime,29497616.98,NA,NA,0,0,0,0,John Herzfeld,"Paul Walker,Laurence Fishburne,Olivia Wilde,Jason Flemyng,Keith Carradine","A DEA agent provides former Marine Tim Kearney with a way out of his prison sentence: impersonate Bobby Z, a recently deceased drug dealer, in a hostage switch with a crime lord."
John Tucker Must Die,2006,5.8,82395,89,Comedy,Romance,24816785.71,19683204.72,94889084.09,0,0,NA,2,Betty Thomas,"Jesse Metcalfe,Brittany Snow,Ashanti,Sophia Bush,Arielle Kebbel",Three ex-girlfriends of a serial cheater set up their former lover to fall for the new girl in town so they can watch him get his heart broken.
The Break-Up,2006,5.8,129861,106,Comedy,Drama,71692936.51,54007922.84,282635182.2,0,0,NA,5,Peyton Reed,"Vince Vaughn,Jennifer Aniston,Joey Lauren Adams,Cole Hauser,Jon Favreau","In a bid to keep their luxurious condo from their significant other, a couple's break-up proceeds to get uglier and nastier by the moment."
The Texas Chainsaw Massacre: The Beginning,2006,5.8,70385,91,Horror,Thriller,22059365.08,25517484.9,71368120.63,0,0,NA,6,Jonathan Liebesman,"Jordana Brewster,Taylor Handley,Diora Baird,Matt Bomer,R. Lee Ermey","Before being sent to serve in Vietnam, two brothers and their girlfriends take one last road trip, but when they get into an accident, a terrifying experience will take them to a secluded house of horrors, with a chainsaw-wielding killer."
Final Destination 3,2006,5.8,137060,93,Horror,Mystery,34467757.94,26434142.52,162300617.7,0,0,NA,6,James Wong,"Mary Elizabeth Winstead,Ryan Merriman,Kris Lemche,Alexz Johnson,Sam Easton","Six years after students cheated death, another teen has a premonition she and her friends will be involved in an accident. When the vision proves true, the student and survivors deal with the repercussions of cheating the Grim Reaper."
The Heartbreak Kid,2007,5.8,89630,116,Comedy,Romance,80448046.31,18800849.21,171309622.9,0,0,NA,0,Bobby Farrelly,"Ben Stiller,Malin Akerman,Michelle Monaghan,Jerry Stiller,Rob Corddry",A newly wed man who believes he's just gotten hitched to the perfect woman encounters another lady on his honeymoon.
Firewall,2006,5.8,57381,105,Action,Crime,68935515.87,18799353.52,114089918.1,0,0,NA,3,Richard Loncraine,"Harrison Ford,Virginia Madsen,Carly Schroeder,Jimmy Bennett,Gail Ann Lewis","A security specialist is forced into robbing the bank that he's protecting, as a bid to pay off his family's ransom."
Cry Wolf,2005,5.8,26946,90,Drama,Horror,1423184.844,6302159.934,22181040.27,0,0,0,0,Jeff Wadlow,"Erica Yates,Julian Morris,Lindy Booth,Jane Beard,Gary Cole","Eight unsuspecting high school seniors at a posh boarding school, who delight themselves on playing games of lies, come face-to-face with terror and learn that nobody believes a liar - even when they're telling the truth."
Blade: Trinity,2004,5.8,172110,113,Action,Horror,95641185.81,23632600.06,189671724,0,0,NA,1,David S. Goyer,"Wesley Snipes,Kris Kristofferson,Dominic Purcell,Jessica Biel,Ryan Reynolds","Blade, now a wanted man by the FBI, must join forces with the Nightstalkers to face his most challenging enemy yet: Dracula."
The Forgotten,2004,5.8,65358,91,Drama,Mystery,61798920.06,30931994.22,173026427.7,0,0,NA,7,Joseph Ruben,"Julianne Moore,Christopher Kovaleski,Matthew Pleszewicz,Anthony Edwards,Jessica Hecht","After being told that their children never existed, a man and woman soon discover there is a much bigger enemy at work."
Dead & Breakfast,2004,5.8,5920,88,Comedy,Fantasy,735701.4293,NA,NA,0,0,NA,1,Matthew Leutwyler,"Jeremy Sisto,Erik Palladino,Bianca Lawson,Oz Perkins,Ever Carradine",A night at a local bed and breakfast turns into a bloody supernatural fight to the death.
The League of Extraordinary Gentlemen,2003,5.8,173132,110,Action,Adventure,117825782.6,34858141.47,270795678.9,0,0,NA,12,Stephen Norrington,"Sean Connery,Naseeruddin Shah,Peta Wilson,Tony Curran,Stuart Townsend","In an alternate Victorian Age world, a group of famous contemporary fantasy, science fiction, and adventure characters team up on a secret mission."
Friday After Next,2002,5.8,26950,85,Comedy,Drama,15450138.97,20101815.82,NA,0,0,0,0,Marcus Raboy,"Ice Cube,Mike Epps,John Witherspoon,Don 'D.C.' Curry,Anna Maria Horsford","Working as security guards, Craig and Day-Day run into the thief who stole their Christmas presents."
Mr. Deeds,2002,5.8,140964,96,Comedy,Romance,77250694.83,57417022.35,264613811.6,0,0,NA,9,Steven Brill,"Adam Sandler,Winona Ryder,John Turturro,Allen Covert,Peter Gallagher","A sweet-natured, small-town guy inherits a controlling stake in a media conglomerate and begins to do business his way."
Beyond Re-Animator,2003,5.8,11774,96,Comedy,Horror,4531760.87,236443.1128,NA,0,0,NA,4,Brian Yuzna,"Jeffrey Combs,Tommy Dean Musset,Jason Barry,Bárbara Elorrieta,Elsa Pataky","After 13 years in prison, the mad scientist from Re-Animator (1985) gets a new chance to experiment with the arrival of a young prison doctor, who secretly hopes to learn to reanimate dead people. Good intentions turn to horror."
The Glass House,2001,5.8,35819,106,Crime,Drama,47083229.81,9006155.532,NA,0,0,NA,3,Daniel Sackheim,"Leelee Sobieski,Diane Lane,Stellan Skarsgård,Bruce Dern,Kathy Baker",An orphaned teenager is taken in by a Malibu couple but discovers they aren't the caring friends they seemed to be.
Get Over It,2001,5.8,18662,87,Comedy,Romance,34527701.86,6489602.412,NA,0,0,NA,4,Tommy O'Haver,"Kirsten Dunst,Ben Foster,Melissa Sagemiller,Sisqó,Shane West",A high school senior's girlfriend breaks up with him. His friends try to make him think of something else. His friend's sister Kelly helps him with the school musical. Spending time with Kelly has an effect.
Just Visiting,2001,5.8,18927,88,Adventure,Comedy,54930434.78,NA,NA,0,0,0,0,Jean-Marie Poiré,"Jean Reno,Christina Applegate,Christian Clavier,Matt Ross,Tara Reid","A French count is in England to marry the princess. She's killed. A wizard helps him time travel back before the murder - but ends up in Chicago, April 2000. A descendant helps him. Can he return to the 1100s?"
Reindeer Games,2000,5.8,39140,104,Action,Adventure,67792195.12,13119978.48,NA,0,0,NA,3,John Frankenheimer,"Ben Affleck,James Frain,Dana Stubblefield,Mark Acheson,Tom Heaton","After assuming his dead cell-mate's identity to get with the other man's girlfriend, an ex-convict finds himself a reluctant participant in a casino heist."
Drive Me Crazy,1999,5.8,19176,91,Comedy,Drama,14181020.41,11421747.53,37693834.6,0,0,NA,0,John Schultz,"Melissa Joan Hart,Adrian Grenier,Stephen Collins,Mark Metcalf,William Converse-Roberts","Nicole and Chase used to be BFFs, then junior high happened. The high school centennial dance is coming but Nicole gets dumped. So does Chase. They stage a relationship to get at their exes. They visit each other's worlds. Love in the air?"
Hollow Man,2000,5.8,128258,112,Action,Horror,153339489,42635457.37,190463786.3,0,1,NA,13,Paul Verhoeven,"Elisabeth Shue,Kevin Bacon,Josh Brolin,Kim Dickens,Greg Grunberg","A brilliant scientist's discovery renders him invisible, but transforms him into an omnipotent, dangerous megalomaniac."
All the Pretty Horses,2000,5.8,14755,116,Drama,Romance,92003693.38,7845422.875,NA,0,0,NA,14,Billy Bob Thornton,"Matt Damon,Henry Thomas,Penélope Cruz,Angelina Torres,J.D. Young","Two Texas cowboys head to Mexico in search of work, but soon find themselves in trouble with the law after one of them falls in love with a wealthy rancher's daughter."
End of Days,1999,5.8,108628,122,Action,Fantasy,166835534.2,34240649.36,353673052.4,0,0,NA,7,Peter Hyams,"Arnold Schwarzenegger,Gabriel Byrne,Robin Tunney,Kevin Pollak,CCH Pounder","At the end of the century, Satan visits New York in search of a bride. It's up to an ex-cop who now runs an elite security outfit to stop him."
Lara Croft: Tomb Raider,2001,5.8,205239,100,Action,Adventure,180485714.3,74918431.93,431130682.9,0,0,NA,21,Simon West,"Angelina Jolie,Jon Voight,Iain Glen,Noah Taylor,Daniel Craig",Video game adventurer Lara Croft comes to life in a movie where she races against time and villains to recover powerful ancient artifacts.
Molly,1999,5.8,2912,102,Comedy,Drama,35035462.18,16154.68478,NA,0,0,0,0,John Duigan,"Elisabeth Shue,Aaron Eckhart,Jill Hennessy,Thomas Jane,D.W. Moffett","A bachelor becomes the unwilling guardian of his autistic, intellectually disabled sister; then an experimental treatment works a dramatic change in her brain and his attitude."
Six Days Seven Nights,1998,5.8,75559,102,Action,Adventure,119364171.8,28110733.09,154320822.1,0,0,NA,5,Ivan Reitman,"Harrison Ford,Anne Heche,David Schwimmer,Jacqueline Obradors,Temuera Morrison","Robin Monroe, a New York magazine editor, and the gruff pilot Quinn Harris must put aside their mutual dislike if they are to survive after crash landing on a deserted South Seas island."
Halloween H20: 20 Years Later,1998,5.8,71894,86,Horror,Thriller,28988441.72,27603346.69,NA,0,0,NA,12,Steve Miner,"Jamie Lee Curtis,Adam Arkin,Michelle Williams,Adam Hann-Byrd,Jodi Lyn O'Keefe","Laurie Strode, now the dean of a Northern California private school with an assumed name, must battle the Shape one last time, as the life of her own son hangs in the balance."
Babe: Pig in the City,1998,5.8,32892,97,Adventure,Comedy,136416196.3,86644747.09,NA,0,1,NA,16,George Miller,"Magda Szubanski,James Cromwell,Mary Stein,Mickey Rooney,Elizabeth Daily","Babe, fresh from his victory in the sheepherding contest, returns to Farmer Hoggett's farm, but after Farmer Hoggett is injured and unable to work, Babe has to go to the big city to save the farm."
54,1998,5.8,32726,93,Drama,Music,22167631.9,11274000.59,NA,0,0,NA,9,Mark Christopher,"Ryan Phillippe,Salma Hayek,Neve Campbell,Mike Myers,Sela Ward",The famous 1970s New York City nightclub seen and told through the eyes of a young employee.
Wishmaster,1997,5.8,22719,90,Fantasy,Horror,8658816.199,10457280.03,NA,0,0,NA,3,Robert Kurtzman,"Angus Scrimm,Ari Barak,Jake McKinnon,Greg Funk,Andrew Divoff","A demonic djinn attempts to grant its owner three wishes, which will allow him to summon his brethren to Earth."
Almost Heroes,1998,5.8,16303,90,Adventure,Comedy,51156073.62,4839241.79,NA,0,0,0,0,Christopher Guest,"Chris Farley,Matthew Perry,Bokeem Woodbine,Barry Del Sherman,Robert Tittor",Two bumbling explorers hope to beat Lewis & Clarke to the Pacific Ocean as they race across America's western frontier in the early 1800's.
A Very Brady Sequel,1996,5.8,10641,90,Comedy,NA,26572466.54,12492681.99,NA,0,0,NA,2,Arlene Sanford,"Shelley Long,Gary Cole,Christopher Daniel Barnes,Christine Taylor,Paul Sutera","The Bradys are surprised when a man claiming to be Carol's long lost first husband shows up at their home. Before long, his strange actions cause them to question his motives."
To Gillian on Her 37th Birthday,1996,5.8,4826,93,Drama,Fantasy,137689.6641,NA,NA,0,0,NA,0,Michael Pressman,"Peter Gallagher,Michelle Pfeiffer,Claire Danes,Laurie Fortier,Wendy Crewson","David's wife died 2 years ago. He, his teen daughter Rachel, her cute friend and 2 in-laws trying to fix him up with a friend, are all spending the weekend at his beach house. David still ""talks to his wife"" and neglects Rachel."
Sgt. Kabukiman N.Y.P.D.,1990,5.8,2916,105,Action,Comedy,3189915.838,NA,NA,0,0,NA,1,Michael Herz,"Rick Gianasi,Susan Byun,Bill Weeden,Thomas Crnkovich,Larry Robinson",A streetwise New York police officer transforms into the world's most unusual superhuman hero.
Bulletproof,1996,5.8,37761,84,Action,Comedy,44287444.23,10654496.18,NA,0,0,NA,2,Ernest R. Dickerson,"Damon Wayans,Adam Sandler,James Caan,Jeep Swenson,James Farentino","Two criminals, Keats and Moses, end their friendship, when Keats turns out to be an undercover cop. Many years later, the two are forced to work together when Keats is assigned to protect Moses as a witness."
Mortal Kombat,1995,5.8,115368,101,Action,Adventure,32828503.94,42465287.56,222861624.5,0,0,NA,3,Paul W.S. Anderson,"Christopher Lambert,Robin Shou,Linden Ashby,Cary-Hiroyuki Tagawa,Bridgette Wilson-Sampras",Three unknowing martial artists are summoned to a mysterious island to compete in a tournament whose outcome will decide the fate of the world.
Men of War,1994,5.8,4116,102,Action,Drama,16129236.17,NA,NA,0,0,0,0,Perry Lang,"Dolph Lundgren,Charlotte Lewis,BD Wong,Tony Denison,Tim Guinee",A former Special Ops soldier leads a group of mercenaries to an island in the South China Sea: their mission is obtain the rights to the unusual treasure that the island beholds.
The Getaway,1994,5.8,18006,115,Action,Adventure,56375431.39,NA,NA,0,0,NA,3,Roger Donaldson,"Alec Baldwin,Kim Basinger,Michael Madsen,James Woods,David Morse",An ex-con and his devoted wife must flee from danger when a heist doesn't go as planned.
Necronomicon,1993,5.8,6076,96,Horror,NA,7694062.284,NA,NA,0,0,NA,3,Christophe Gans,"Jeffrey Combs,Tony Azito,Juan Fernández,Brian Yuzna,Bruce Payne","Lovecraft visualizes 3 stories in Necronomicon: The Drowned, The Cold and Whispers, about bringing a dead wife and child back to life, extending life and aliens."
The Crush,1993,5.8,19317,89,Drama,Thriller,11541093.43,NA,NA,0,0,NA,3,Alan Shapiro,"Cary Elwes,Alicia Silverstone,Jennifer Rubin,Kurtwood Smith,Amber Benson","A journalist becomes the unwanted center of attention for a 14-year-old girl, who proceeds to sabotage his life after he refuses her sexual advances."
Johnny Suede,1991,5.8,3995,97,Comedy,Drama,1020367.107,NA,NA,0,0,NA,3,Tom DiCillo,"Brad Pitt,Richard Boes,Cheryl Costa,Michael Luciano,Calvin Levels",A struggling young musician and devoted fan of Ricky Nelson wants to be just like his idol and become a rock star.
California Man,1992,5.8,39257,88,Comedy,NA,13867683.54,19545806.56,NA,0,0,NA,1,Les Mayfield,"Sean Astin,Brendan Fraser,Pauly Shore,Megan Ward,Robin Tunney","When they find a frozen caveman in their back yard, two high school outcasts thaw him and introduce him to modern life while he in turn gets them to actually enjoy life."
Hudson Hawk,1991,5.8,55075,100,Action,Adventure,132647723.9,NA,NA,0,0,NA,5,Michael Lehmann,"Bruce Willis,Danny Aiello,Andie MacDowell,James Coburn,Richard E. Grant",A cat burglar is forced to steal Da Vinci works of art for a world domination plot.
RoboCop 2,1990,5.8,84376,117,Action,Crime,53165263.96,30081780.39,NA,0,0,NA,3,Irvin Kershner,"Peter Weller,Nancy Allen,Belinda Bauer,Dan O'Herlihy,Felton Perry","RoboCop returns to protect the citizens of old Detroit but faces a deadly challenge when a rogue OCP member secretly creates a new, evil RoboCop 2."
Hard to Kill,1990,5.8,29159,96,Action,Crime,21266105.59,NA,NA,0,0,0,0,Bruce Malmuth,"Steven Seagal,Kelly LeBrock,William Sadler,Frederick Coffin,Bonnie Burroughs","Left for dead with his wife killed in their house, L.A. Detective Mason Storm will have to make a quick recovery, expose those behind the murder and take revenge."
Air America,1990,5.8,28169,113,Action,Comedy,74431369.55,17150008.32,NA,0,0,NA,1,Roger Spottiswoode,"Mel Gibson,Robert Downey Jr.,Nancy Travis,Ken Jenkins,David Marshall Grant",A young pilot finds himself recruited unwittingly into a covert and corrupt C.I.A. airlift organization operating in Vietnam War-era Laos.
Millennium,1989,5.8,6309,108,Drama,Sci-Fi,3619358.161,NA,NA,0,0,NA,5,Michael Anderson,"Kris Kristofferson,Cheryl Ladd,Daniel J. Travanti,Robert Joy,Lloyd Bochner",An NTSB investigator seeking the cause of an airline disaster meets a warrior woman from 1000 years in the future.
Tapeheads,1988,5.8,4055,93,Comedy,Music,7048554.522,NA,NA,0,0,0,0,Bill Fishman,"John Cusack,Tim Robbins,Mary Crosby,Clu Gulager,Katy Boyer",A couple of creative losers accidently become big shots in the video music industry.
Return of the Living Dead: Part II,1988,5.8,19410,89,Comedy,Horror,14567012.68,10751395.16,1975582.959,0,0,NA,3,Ken Wiederhorn,"Michael Kenworthy,Thor Van Lingen,Jason Hogan,James Karen,Thom Mathews","Curious kids unearth the barrels that previously helped revive the dead, which proves the second time's an undead charm."
Rambo III,1988,5.8,127461,102,Action,Adventure,148019645,39343663.92,444095613.2,0,0,NA,5,Peter MacDonald,"Sylvester Stallone,Richard Crenna,Marc de Jonge,Kurtwood Smith,Spyros Fokas",Rambo mounts a one-man mission to rescue his friend Colonel Trautman from the clutches of the formidable invading Soviet forces in Afghanistan.
High Spirits,1988,5.8,9309,99,Comedy,Fantasy,39941808.96,NA,NA,0,0,NA,1,Neil Jordan,"Peter O'Toole,Donal McCann,Mary Coughlan,Liz Smith,Tom Hickey","When a hotelier attempts to fill the chronic vacancies at his castle by launching an advertising campaign that falsely portrays the property as haunted, two actual ghosts show up and end up falling for two guests."
Halloween 4: The Return of Michael Myers,1988,5.8,49636,88,Horror,Thriller,11747590.87,16050146.03,NA,0,0,NA,2,Dwight H. Little,"Donald Pleasence,Ellie Cornell,Danielle Harris,George P. Wilbur,Michael Pataki","Ten years after his original massacre, the invalid Michael Myers awakens on Halloween Eve and returns to Haddonfield to kill his seven-year-old niece. Can Dr. Loomis stop him?"
Over the Top,1987,5.8,52882,93,Action,Drama,61168133.8,12598678.18,NA,0,0,NA,2,Menahem Golan,"Sylvester Stallone,Robert Loggia,Susan Blakely,Rick Zumwalt,David Mendenhall",Tough trucker Lincoln Hawk is determined to win back his son and triumph at the world arm wrestling championships.
Malone,1987,5.8,2965,92,Action,Drama,24467253.52,NA,NA,0,0,0,0,Harley Cokeliss,"Burt Reynolds,Cliff Robertson,Kenneth McMillan,Cynthia Gibb,Scott Wilson",An ex-C.I.A. hit man running from his past (Malone) finds just how difficult it is to retire when he runs across a small town controlled by mercenaries and a family that's resisting their control.
Sweet Liberty,1986,5.8,2743,106,Comedy,NA,8016088.793,NA,NA,0,0,0,0,Alan Alda,"Alan Alda,Michael Caine,Michelle Pfeiffer,Bob Hoskins,Lise Hilboldt","After selling the rights of his book to a movie production company, a writer finds himself fighting the many egos and varying views around him."
From a Whisper to a Scream,1987,5.8,2355,99,Action,Drama,2691397.887,NA,NA,0,0,0,0,Jeff Burr,"Vincent Price,Clu Gulager,Terry Kiser,Harry Caesar,Rosalind Cash","In a small Tennessee town, a historian relates four horror stories to a reporter."
Cobra,1986,5.8,70933,87,Action,Crime,63400547.45,405763503.6,NA,0,0,NA,6,George P. Cosmatos,"Sylvester Stallone,Brigitte Nielsen,Reni Santoni,Andrew Robinson,Brian Thompson",A tough-on-crime street cop must protect the only surviving witness to a strange murderous cult with far-reaching plans.
Police Academy 2: Their First Assignment,1985,5.8,53841,87,Comedy,NA,19632014.87,27577545.92,105306378.3,0,0,NA,0,Jerry Paris,"Steve Guttenberg,Bubba Smith,David Graf,Michael Winslow,Bruce Mahler",When a new gang moves into town it's up to the screwball police team to stop them.
Tank,1984,5.8,4271,113,Action,Comedy,10796795.09,NA,NA,0,0,NA,1,Marvin J. Chomsky,"James Garner,Shirley Jones,C. Thomas Howell,Mark Herrier,Sandy Ward","Sergeant Major Zack arrives at a new army base with his wife, son and Sherman tank. One night at a bar he ""stops"" a pimp/deputy from beating a girl. The corrupt sheriff uses Zack's son for revenge and Zack uses his tank."
Irreconcilable Differences,1984,5.8,3064,113,Comedy,Drama,16050895.09,8231150.467,NA,0,0,NA,3,Charles Shyer,"Ryan O'Neal,Shelley Long,Drew Barrymore,Sam Wanamaker,Allen Garfield","Alternating between the past and the present, a precocious little girl sues her selfish, career-driven parents for emancipation, surprising them both."
Angel,1983,5.8,3493,94,Action,Crime,8371927.711,6180782.14,NA,0,0,NA,0,Robert Vincent O'Neil,"Cliff Gorman,Susan Tyrrell,Dick Shawn,Rory Calhoun,Donna Wilkes","Molly, a highschooler, secretly earns her living as Angel, a street prostitute whose only family and friends are the ones she works with on the streets. She has to survive against a serial killer who is targeting people of her profession."
The Blue Lagoon,1980,5.8,67160,104,Adventure,Drama,15179199.03,NA,NA,0,1,NA,7,Randal Kleiser,"Brooke Shields,Christopher Atkins,Leo McKern,William Daniels,Elva Josephson","In the Victorian period, two children are shipwrecked on a tropical island in the South Pacific. With no adults to guide them, the two make a simple life together, unaware that sexual maturity will eventually intervene."
Circle of Iron,1978,5.8,2293,102,Action,Adventure,17052024.54,NA,NA,0,0,NA,1,Richard Moore,"David Carradine,Jeff Cooper,Christopher Lee,Roddy McDowall,Eli Wallach","A young martial artist embarks on an adventure, encountering other martial artists in battle until one day he meets an aging blind man who will show him the true meaning of martial arts and life."
1941,1979,5.8,32825,118,Action,Comedy,133996969.7,10344175.56,NA,0,3,NA,33,Steven Spielberg,"Dan Aykroyd,Ned Beatty,John Belushi,Lorraine Gary,Murray Hamilton",Hysterical Californians prepare for a Japanese invasion in the days after Pearl Harbor.
Jaws 2,1978,5.8,75903,116,Adventure,Horror,85260122.7,42058916.58,NA,0,0,0,0,Jeannot Szwarc,"Roy Scheider,Lorraine Gary,Murray Hamilton,Joseph Mascolo,Jeffrey Kramer",Police chief Brody must protect the citizens of Amity after a second monstrous shark begins terrorizing the waters.
Futureworld,1976,5.8,10487,108,Sci-Fi,Thriller,12212126.54,NA,NA,0,0,NA,3,Richard T. Heffron,"Peter Fonda,Blythe Danner,Arthur Hill,Yul Brynner,John P. Ryan","Upon uncovering the dirty secret of futuristic theme-park Futureworld, an ex-employee is killed after he tips off two other reporters who decide to do an undercover investigation."
The Groove Tube,1974,5.8,2098,75,Comedy,NA,1127578.093,NA,NA,0,0,0,0,Ken Shapiro,"Ken Shapiro,Richard Belzer,Chevy Chase,Buzzy Linhart,Richmond Baier","A collection of skits that make fun of 1970s television, featuring early appearances by Chevy Chase and Richard Belzer."
Flesh for Frankenstein,1973,5.8,5713,95,Horror,Sci-Fi,2817040.541,95528974.77,NA,0,0,0,0,Paul Morrissey,"Joe Dallesandro,Monique van Vooren,Udo Kier,Arno Jürging,Dalila Di Lazzaro","Baron Frankenstein creates two ""zombies"" - one male, one female - planning to mate them in order to create a master race."
"Count Yorga, Vampire",1970,5.8,2499,93,Drama,Fantasy,458470.9278,NA,NA,0,0,0,0,Bob Kelljan,"Robert Quarry,Roger Perry,Michael Murphy,Michael Macready,Donna Anders","A couple invites a Count from Hungary, who recently immigrated to America, to conduct a seance for the woman's recently deceased mother, oblivious to the fact that he is actually a vampire."
200 Motels,1971,5.8,2127,98,Comedy,Fantasy,4659918.321,NA,NA,0,0,0,0,Tony Palmer,"Mark Volman,Howard Kaylan,Ian Underwood,Aynsley Dunbar,George Duke","The great Frank Zappa's outrageous psychedelic precursor to today's music videos features ""The Mothers of Invention"" wreaking havoc in a typical American town. Ringo Starr narrates."
