name,year,rating,imdb_votes,run_time,genre1,genre2,budget_USD,openning_USD,gross_USD,Oscar_wins,Oscar_nominations,other_wins,other_nominations,director,cast,synopsis
The Frighteners,1996,7.1,86001,110,Comedy,Fantasy,53144933.08,22320871.89,NA,0,0,3,16,Peter Jackson,"Michael J. Fox,Trini Alvarado,Peter Dobson,John Astin,Jeffrey Combs","After a tragic car accident that kills his wife, a man discovers he can communicate with the dead to con people. However, when a demonic spirit appears, he may be the only one who can stop it from killing the living and the dead."
Alferd Packer: The Musical,1993,7.1,12216,95,Comedy,Musical,240439.4464,NA,NA,0,0,0,0,Trey Parker,"Dian Bachar,Stephen Blackpool,Stan Brakhage,Dan Brother,Duster",The sole survivor of an ill-fated mining expedition tells how his taste for gold was replaced by that of human flesh.
The Birdcage,1996,7.1,85809,117,Comedy,NA,54916430.85,294309.5534,328188656.4,0,1,7,24,Mike Nichols,"Robin Williams,Gene Hackman,Nathan Lane,Dianne Wiest,Dan Futterman",A gay cabaret owner and his drag queen companion agree to put up a false straight front so that their son can introduce them to his fiancée's right-wing moralistic parents.
Nixon,1995,7.1,30238,192,Biography,Drama,91190288.71,4024238.384,NA,0,4,11,14,Oliver Stone,"Anthony Hopkins,Joan Allen,Powers Boothe,Ed Harris,Bob Hoskins","A biographical story of former U.S. President Richard Nixon, from his days as a young boy, to his eventual Presidency, which ended in shame."
Mallrats,1995,7.1,120339,94,Comedy,Romance,14590446.19,640540.6498,NA,0,0,0,0,Kevin Smith,"Shannen Doherty,Jeremy London,Jason Lee,Claire Forlani,Ben Affleck","Both dumped by their girlfriends, two best friends seek refuge in the local mall."
Kids,1995,7.1,76460,91,Drama,NA,2735708.661,36476115.49,NA,0,0,15,5,Larry Clark,"Leo Fitzpatrick,Sarah Henderson,Justin Pierce,Joseph Chan,Johnathan Staci Kim","A day in the life of a group of teens as they travel around New York City skating, drinking, smoking and deflowering virgins."
Stargate,1994,7.1,184186,116,Action,Adventure,103152091.8,31133176.79,368721840.8,0,0,6,6,Roland Emmerich,"Kurt Russell,James Spader,Jaye Davidson,Viveca Lindfors,Alexis Cruz","An interstellar teleportation device, found in Egypt, leads to a planet with humans resembling ancient Egyptians who worship the god Ra."
The Last Seduction,1994,7.1,22700,110,Crime,Drama,4688731.444,NA,NA,0,0,9,9,John Dahl,"Linda Fiorentino,Bill Pullman,Michael Raysses,Zack Phifer,Peter Berg",A devious sexpot steals her husband's drug money and hides out in a small town where she meets the perfect dupe for her next scheme.
Four Weddings and a Funeral,1994,7.1,147066,117,Comedy,Drama,8252167.341,460810086.7,NA,0,2,24,26,Mike Newell,"Hugh Grant,James Fleet,Simon Callow,John Hannah,Kristin Scott Thomas","Over the course of five social occasions, a committed bachelor must consider the notion that he may have discovered love."
Sneakers,1992,7.1,57053,126,Comedy,Crime,45565245.9,208476848.8,NA,0,0,2,2,Phil Alden Robinson,"Jo Marr,Gary Hershberger,Robert Redford,Sidney Poitier,David Strathairn","A security pro finds his past coming back to haunt him, when he and his unique team are tasked with retrieving a particularly important item."
Little Nemo,1989,7.1,7205,85,Animation,Adventure,78453064.52,NA,NA,0,0,11,1,Masami Hata,"Gabriel Damon,Mickey Rooney,Rene Auberjonois,Danny Mann,Laura Mooney","Each night, young Nemo goes to Slumberland and has adventures and befriends the king of Slumberland, Morpheus. But one night Nemo discovers Nightmare Land, and the evil nightmare king, throwing Slumberland and Nemo himself into danger."
Like Water for Chocolate,1992,7.1,17580,105,Drama,Romance,3962195.296,NA,NA,0,0,26,12,Alfonso Arau,"Marco Leonardi,Lumi Cavazos,Regina Torné,Mario Iván Martínez,Ada Carrasco","When tradition prevents her from marrying the man she loves, a young woman discovers she has a unique talent for cooking."
Bad Lieutenant,1992,7.1,41689,96,Crime,Drama,1981097.648,94011.00778,5008006.839,0,0,2,5,Abel Ferrara,"Harvey Keitel,Brian McElroy,Frank Acciarito,Peggy Gormley,Stella Keitel","While investigating a young nun's rape, a corrupt New York City police detective, with a serious drug and gambling addiction, tries to change his ways and find forgiveness and redemption."
Tremors,1990,7.1,131298,96,Comedy,Horror,23392716.14,7935489.831,103293728,0,0,5,5,Ron Underwood,"Kevin Bacon,Fred Ward,Finn Carter,Michael Gross,Reba McEntire",Natives of a small isolated town defend themselves against strange underground creatures which are killing them one by one.
Pretty Woman,1990,7.1,308109,119,Comedy,Romance,29772547.82,23989423.93,985484662.4,0,1,8,10,Garry Marshall,"Richard Gere,Julia Roberts,Ralph Bellamy,Jason Alexander,Laura San Giacomo","A man in a legal but hurtful business needs an escort for some social events, and hires a beautiful prostitute he meets... only to fall in love."
Ghost,1990,7.1,208445,127,Drama,Fantasy,46785432.29,25926657.69,616717062,2,0,16,23,Jerry Zucker,"Patrick Swayze,Demi Moore,Tony Goldwyn,Stanley Lawrence,Christopher J. Keene","After a young man is murdered, his spirit stays behind to warn his lover of impending danger, with the help of a reluctant psychic."
Die Hard 2,1990,7.1,350384,124,Action,Thriller,148862739.1,46242425.67,510452658.9,0,0,11,1,Renny Harlin,"Bruce Willis,Bonnie Bedelia,William Atherton,Reginald VelJohnson,Franco Nero","John McClane attempts to avert disaster as rogue military operatives seize control of Dulles International Airport in Washington, D.C."
Uncle Buck,1989,7.1,91143,100,Comedy,NA,33622741.94,19713015.84,177659291.3,0,0,0,0,John Hughes,"John Candy,Jean Louisa Kelly,Gaby Hoffmann,Macaulay Culkin,Amy Madigan",Bachelor and all-round slob Buck babysits his brother's rebellious teenage daughter and her cute younger brother and sister.
Casualties of War,1989,7.1,43143,113,Action,Crime,50434112.9,11658710.42,NA,0,0,15,5,Brian De Palma,"Michael J. Fox,Sean Penn,Don Harvey,John C. Reilly,John Leguizamo","During the Vietnam War, a soldier finds himself the outsider of his own squad when they unnecessarily kidnap a female villager."
Spaceballs,1987,7.1,182293,96,Adventure,Comedy,55540665.49,16148387.32,NA,0,0,1,0,Mel Brooks,"Mel Brooks,John Candy,Rick Moranis,Bill Pullman,Daphne Zuniga",A star-pilot for hire and his trusty sidekick must come to the rescue of a princess and save Planet Druidia from the clutches of the evil Spaceballs.
Some Kind of Wonderful,1987,7.1,30170,95,Drama,Romance,8530999.732,NA,NA,0,0,1,0,Howard Deutch,"Eric Stoltz,Mary Stuart Masterson,Lea Thompson,Craig Sheffer,John Ashton","When Keith goes out with Amanda, the girl of his dreams, Amanda's ex-boyfriend plans to get back at Keith. Meanwhile, Keith's best friend, tomboy Watts, realizes she has feelings for Keith."
Little Shop of Horrors,1986,7.1,72089,94,Comedy,Horror,63400547.45,9281545.967,NA,0,2,2,12,Frank Oz,"Levi Stubbs,Rick Moranis,Ellen Greene,Vincent Gardenia,Steve Martin",A nerdy florist finds his chance for success and romance with the help of a giant man-eating plant who demands to be fed.
Highlander,1986,7.1,130681,116,Action,Adventure,40576350.36,32677131.61,NA,0,0,0,0,Russell Mulcahy,"Christopher Lambert,Roxanne Hart,Clancy Brown,Sean Connery,Beatie Edney","An immortal Scottish swordsman must confront the last of his immortal opponent, a murderously brutal barbarian who lusts for the fabled ""Prize""."
Fright Night,1985,7.1,66797,106,Comedy,Fantasy,23248438.66,15805174.63,NA,0,0,5,5,Tom Holland,"Chris Sarandon,William Ragsdale,Amanda Bearse,Roddy McDowall,Stephen Geoffreys","A teenager discovers that the newcomer in his neighborhood is a vampire, so he turns to an actor in a television horror show for help dealing with the undead."
1984,1984,7.1,70134,113,Drama,Sci-Fi,10672074.29,NA,NA,0,0,6,2,Michael Radford,"John Hurt,Richard Burton,Suzanna Hamilton,Cyril Cusack,Gregor Fisher","In a totalitarian future society, a man, whose daily work is re-writing history, tries to rebel by falling in love."
The Bounty,1984,7.1,26343,132,Adventure,Drama,66878729.55,NA,NA,0,0,2,2,Roger Donaldson,"Mel Gibson,Anthony Hopkins,Laurence Olivier,Edward Fox,Daniel Day-Lewis","Fed up with their Captain's harsh discipline, a sailing ship's crew decides to take action."
WarGames,1983,7.1,95990,114,Action,Adventure,33487710.84,17379574.96,NA,0,3,4,11,John Badham,"Matthew Broderick,Dabney Coleman,John Wood,Ally Sheedy,Barry Corbin","A young man finds a back door into a military central computer in which reality is confused with game-playing, possibly starting World War III."
The Outsiders,1983,7.1,81866,91,Crime,Drama,27906425.7,14143437,NA,0,0,14,4,Francis Ford Coppola,"C. Thomas Howell,Matt Dillon,Ralph Macchio,Patrick Swayze,Rob Lowe","The rivalry between two gangs, the poor Greasers and the rich Socs, only heats up when one gang member kills a member of the other."
Diner,1982,7.1,20438,110,Comedy,Drama,14401450.78,NA,NA,0,1,3,5,Barry Levinson,"Steve Guttenberg,Daniel Stern,Mickey Rourke,Kevin Bacon,Tim Daly",A group of college-age buddies struggle with their imminent passage into adulthood in 1959 Baltimore.
Dressed to Kill,1980,7.1,39622,104,Crime,Drama,21925509.71,NA,NA,0,0,110,10,Brian De Palma,"Michael Caine,Angie Dickinson,Nancy Allen,Keith Gordon,Dennis Franz","A mysterious blonde woman kills one of a psychiatrist's patients, and then goes after the high-class call girl who witnessed the murder."
The Big Red One,1980,7.1,19437,113,Drama,War,15179199.03,NA,NA,0,0,2,2,Samuel Fuller,"Lee Marvin,Mark Hamill,Robert Carradine,Bobby Di Cicco,Kelly Ward",A hardened sergeant and the four core members of his infantry unit try to survive World War II as they move from battle to battle throughout Europe.
Martin,1976,7.1,10788,95,Drama,Horror,390788.0492,NA,NA,0,0,1,0,George A. Romero,"John Amplas,Lincoln Maazel,Christine Forrest,Elyane Nadeau,Tom Savini","A young man, who believes himself to be a vampire, goes to live with his elderly and hostile cousin in a small Pennsylvania town where he tries to redeem his blood-craving urges."
The Spy Who Loved Me,1977,7.1,104863,125,Action,Adventure,64212409.24,850355762.4,NA,0,3,3,8,Lewis Gilbert,"Roger Moore,Barbara Bach,Curd Jürgens,Richard Kiel,Caroline Munro","James Bond investigates the hijacking of British and Russian submarines carrying nuclear warheads, with the help of a K.G.B. agent whose lover he killed."
The Return of the Pink Panther,1975,7.1,26659,113,Comedy,Crime,25831598.51,NA,NA,0,0,2,5,Blake Edwards,"Peter Sellers,Christopher Plummer,Catherine Schell,Herbert Lom,Peter Arne","Inspector Jacque Clouseau (Peter Sellers) is put on the case when the Pink Panther diamond is stolen, with the Phantom's trademark glove the only clue."
The Mean Machine,1974,7.1,18276,121,Comedy,Crime,16349882.35,NA,NA,0,1,2,3,Robert Aldrich,"Burt Reynolds,Eddie Albert,Ed Lauter,Michael Conrad,James Hampton","A sadistic warden asks a former pro quarterback, now serving time in his prison, to put together a team of inmates to take on (and get pummeled by) the guards."
Soylent Green,1973,7.1,61779,97,Crime,Mystery,25040360.36,NA,NA,0,0,3,1,Richard Fleischer,"Charlton Heston,Leigh Taylor-Young,Chuck Connors,Joseph Cotten,Brock Peters",A nightmarish futuristic fantasy about the controlling power of big corporations and an innocent cop who stumbles on the truth.
Ulzana's Raid,1972,7.1,5596,103,Adventure,Western,7979368.421,NA,NA,0,0,0,0,Robert Aldrich,"Burt Lancaster,Bruce Davison,Jorge Luke,Richard Jaeckel,Joaquín Martínez","After fierce war chief Ulzana and a small war party jump the reservation bent on murder and terror, an inexperienced young lieutenant is assigned to track him down."
The Panic in Needle Park,1971,7.1,17492,110,Drama,NA,11289492.84,NA,NA,0,0,11,1,Jerry Schatzberg,"Al Pacino,Kitty Winn,Alan Vint,Richard Bright,Kiel Martin","Follows the lives of heroin addicts who frequent ""Needle Park"" in New York City."
Bedknobs and Broomsticks,1971,7.1,36233,117,Animation,Adventure,137258271.6,NA,NA,1,0,15,5,Robert Stevenson,"Angela Lansbury,David Tomlinson,Roddy McDowall,Sam Jaffe,John Ericson","An apprentice witch, three kids and a cynical magician conman search for the missing component to a magic spell to be used in the defense of Britain in World War II."
The Abominable Dr. Phibes,1971,7.1,14571,94,Comedy,Horror,2737842.703,NA,NA,0,0,12,2,Robert Fuest,"Vincent Price,Joseph Cotten,Virginia North,Terry-Thomas,Sean Bury","A doctor, scientist, organist, and biblical scholar, Anton Phibes, seeks revenge on the nine doctors he considers responsible for his wife's death."
The Private Life of Sherlock Holmes,1970,7.1,11645,125,Adventure,Comedy,71636082.47,NA,NA,0,0,3,3,Billy Wilder,"Robert Stephens,Colin Blakely,Geneviève Page,Christopher Lee,Tamara Toumanova","When a bored Holmes eagerly takes the case of Gabrielle Valladon after an attempt on her life, the search for her missing husband leads to Loch Ness and the legendary monster."
The AristoCats,1970,7.1,99551,78,Animation,Adventure,28654432.99,22694819.54,NA,0,0,3,0,Wolfgang Reitherman,"Phil Harris,Eva Gabor,Sterling Holloway,Scatman Crothers,Paul Winchell","With the help of a smooth talking tomcat, a family of Parisian felines set to inherit a fortune from their owner try to make it back home after a jealous butler kidnaps them and leaves them in the country."
Ralph Breaks the Internet,2018,7,147338,112,Animation,Adventure,193705870.4,62248913.39,585903764.5,0,1,3,66,Phil Johnston,"John C. Reilly,Sarah Silverman,Gal Gadot,Taraji P. Henson,Jack McBrayer","Six years after the events of ""Wreck-It Ralph,"" Ralph and Vanellope, now friends, discover a wi-fi router in their arcade, leading them into a new adventure."
Green Room,2015,7,116070,95,Horror,Thriller,5863461.271,103178.1553,NA,0,0,8,25,Jeremy Saulnier,"Anton Yelchin,Joe Cole,Alia Shawkat,Callum Turner,David W. Thompson",A punk rock band is forced to fight for survival after witnessing a murder at a neo-Nazi skinhead bar.
Spy,2015,7,238904,120,Action,Comedy,76224996.52,34108597.38,NA,0,0,6,30,Paul Feig,"Jude Law,Raad Rawi,Melissa McCarthy,Jessica Chaffin,Miranda Hart","A desk-bound CIA analyst volunteers to go undercover to infiltrate the world of a deadly arms dealer, and prevent diabolical global disaster."
The Croods: A New Age,2020,7,35662,95,Animation,Adventure,69806229.26,231870320.3,NA,0,0,30,30,Joel Crawford,"Nicolas Cage,Emma Stone,Ryan Reynolds,Catherine Keener,Cloris Leachman","The prehistoric family the Croods are challenged by a rival family the Bettermans, who claim to be better and more evolved."
Furious 6,2013,7,383929,130,Action,Adventure,190900810,116181332.2,940997638.8,0,0,10,22,Justin Lin,"Vin Diesel,Paul Walker,Dwayne Johnson,Jordana Brewster,Michelle Rodriguez","Hobbs has Dominic and Brian reassemble their crew to take down a team of mercenaries: Dominic unexpectedly gets sidetracked with facing his presumed deceased girlfriend, Letty."
The Words,2012,7,76876,102,Drama,Mystery,7263639.294,5751463.39,16018093.34,0,0,13,3,Brian Klugman,"Dennis Quaid,John Hannah,Jeremy Irons,Bradley Cooper,Zoe Saldana",A writer at the peak of his literary success discovers the steep price he must pay for stealing another man's work.
We're the Millers,2013,7,428599,110,Comedy,Crime,44145812.32,31521775.6,322138100.1,0,0,4,17,Rawson Marshall Thurber,"Jennifer Aniston,Jason Sudeikis,Emma Roberts,Will Poulter,Ed Helms",A veteran pot dealer creates a fake family as part of his plan to move a huge shipment of weed into the U.S. from Mexico.
Chronicle,2012,7,246012,89,Action,Drama,14527278.59,26638305.14,153306488.4,0,0,2,7,Josh Trank,"Dane DeHaan,Alex Russell,Michael B. Jordan,Michael Kelly,Ashley Hinshaw",Three high school friends gain superpowers after making an incredible discovery underground. Soon they find their lives spinning out of control and their bond tested as they embrace their darker sides.
Super 8,2011,7,347534,112,Mystery,Sci-Fi,61782972.27,43805570.59,321390061.8,0,0,11,70,J.J. Abrams,"Joel Courtney,Jessica Tuck,Joel McKinnon Miller,Ryan Lee,Zach Mills","During the summer of 1979, a group of friends witness a train crash and investigate subsequent unexplained events in their small town."
The Foreigner,2017,7,109452,113,Action,Thriller,39687418.41,164843505.5,NA,0,0,1,1,Martin Campbell,"Katie Leung,Jackie Chan,Rufus Jones,Mark Tandy,John Cronin","A humble businessman with a buried past seeks justice when his daughter is killed in an act of terrorism. A cat-and-mouse conflict ensues with a government official, whose past may hold clues to the killers' identities."
Maleficent,2014,7,361260,97,Adventure,Family,211335158.2,81518190.8,890589585.7,0,1,12,42,Robert Stromberg,"Angelina Jolie,Elle Fanning,Sharlto Copley,Lesley Manville,Imelda Staunton","A vengeful fairy is driven to curse an infant princess, only to discover that the child may be the one person who can restore peace to their troubled land."
Oblivion,2013,7,505846,124,Action,Adventure,143175607.5,44210820.01,341436326.2,0,0,117,17,Joseph Kosinski,"Tom Cruise,Morgan Freeman,Olga Kurylenko,Andrea Riseborough,Nikolaj Coster-Waldau",A veteran assigned to extract Earth's remaining resources begins to question what he knows about his mission and himself.
Prometheus,2012,7,589717,124,Adventure,Mystery,157378851.4,61801586.6,488303561.7,0,1,6,46,Ridley Scott,"Noomi Rapace,Michael Fassbender,Charlize Theron,Idris Elba,Guy Pearce","Following clues to the origin of mankind, a team finds a structure on a distant moon, but they soon realize they are not alone."
Den of Thieves,2018,7,102865,140,Action,Crime,33206720.64,16831499.35,89115350.89,0,0,1,1,Christian Gudegast,"Gerard Butler,Pablo Schreiber,O'Shea Jackson Jr.,50 Cent,Meadow Williams",An elite unit of the LA County Sheriff's Dept. and the state's most successful bank robbery crew clash as the outlaws plan a seemingly impossible heist on the Federal Reserve Bank.
RED,2010,7,300856,111,Action,Comedy,73930476.57,27738470.08,253666155.7,0,0,4,19,Robert Schwentke,"Bruce Willis,Mary-Louise Parker,Heidi von Palleske,Jefferson Brown,Karl Urban","When his peaceful life is threatened by a high-tech assassin, former black-ops agent Frank Moses reassembles his old team in a last-ditch effort to survive and uncover his assailants."
Iron Man 2,2010,7,768706,124,Action,Adventure,254932677.8,163313034.6,795304974.3,0,1,7,43,Jon Favreau,"Robert Downey Jr.,Gwyneth Paltrow,Don Cheadle,Scarlett Johansson,Sam Rockwell","With the world now aware of his identity as Iron Man, Tony Stark must contend with both his declining health and a vengeful mad man with ties to his father's legacy."
Shinjuku Incident,2009,7,12313,119,Action,Crime,19433570.9,NA,NA,0,0,16,6,Tung-Shing Yee,"Jackie Chan,Naoto Takenaka,Daniel Wu,Jinglei Xu,Masaya Katô",A simple Chinese immigrant wages a perilous war against one of the most powerful criminal organizations on the planet.
Cloverfield,2008,7,386115,85,Action,Horror,32274050.99,59573439.14,220449875.3,0,0,5,34,Matt Reeves,"Lizzy Caplan,Jessica Lucas,T.J. Miller,Michael Stahl-David,Mike Vogel",A group of friends venture deep into the streets of New York on a rescue mission during a rampaging monster attack.
Tropic Thunder,2008,7,398037,107,Action,Comedy,118768507.6,33323339.77,242794650.5,0,1,10,46,Ben Stiller,"Jeff Kahn,Robert Downey Jr.,Anthony Ruivivar,Jack Black,Jay Baruchel","Through a series of freak occurrences, a group of actors shooting a big-budget war movie are forced to become the soldiers they are portraying."
World War Z,2013,7,632907,116,Action,Adventure,226694711.9,79237955.66,644299630.9,0,0,3,25,Marc Forster,"Brad Pitt,Mireille Enos,Daniella Kertesz,James Badge Dale,Ludi Boeken",Former United Nations employee Gerry Lane traverses the world in a race against time to stop a zombie pandemic that is toppling armies and governments and threatens to destroy humanity itself.
Thor,2011,7,793957,115,Action,Adventure,185348916.8,81211663.39,555214679.6,0,0,5,30,Kenneth Branagh,"Chris Hemsworth,Natalie Portman,Tom Hiddleston,Anthony Hopkins,Stellan Skarsgård","The powerful but arrogant god Thor is cast out of Asgard to live amongst humans in Midgard (Earth), where he soon becomes one of their finest defenders."
Jack Reacher,2012,7,325046,130,Action,Thriller,72636392.94,18413514.46,264324554.2,0,0,16,6,Christopher McQuarrie,"Tom Cruise,Rosamund Pike,Richard Jenkins,David Oyelowo,Werner Herzog",A homicide investigator digs deeper into a case involving a trained military sniper who shot five random victims.
Rambo,2008,7,225654,92,Action,Adventure,64548101.98,146194079.6,NA,0,0,11,1,Sylvester Stallone,"Sylvester Stallone,Julie Benz,Matthew Marsden,Graham McTavish,Reynaldo Gallegos","In Thailand, John Rambo joins a group of mercenaries to venture into war-torn Burma, and rescue a group of Christian aid workers who were kidnapped by the ruthless local infantry unit."
Grandma's Boy,2006,7,80988,94,Comedy,NA,4149009.485,NA,NA,0,0,1,1,Nicholaus Goossen,"Linda Cardellini,Allen Covert,Peter Dante,Shirley Jones,Shirley Knight",A thirty-five-year-old video game tester has to move in with his grandma and her two old lady roommates.
Jarhead,2005,7,183328,125,Action,Biography,102469308.8,39459521.85,137892376.7,0,0,6,12,Sam Mendes,"Jake Gyllenhaal,Scott MacDonald,Peter Sarsgaard,Jamie Foxx,Ming Lo","A psychological study of Marine's state of mind during the Gulf War. Told through the eyes of a U.S. Marine sniper who struggles to cope with boredom, a sense of isolation, and other issues back home."
Transformers,2007,7,617521,144,Action,Adventure,201120115.8,94529650.88,951579420.8,0,3,25,47,Michael Bay,"Shia LaBeouf,Megan Fox,Josh Duhamel,Tyrese Gibson,Rachael Taylor","An ancient struggle between two Cybertronian races, the heroic Autobots and the evil Decepticons, comes to Earth, with a clue to the ultimate power held by a teenager."
New Police Story,2004,7,26295,123,Action,Crime,15085593.12,1052522.421,16211266.34,0,0,7,22,Benny Chan,"Jackie Chan,Nicholas Tse,Charlie Yeung,Daniel Wu,Andy On","A hero cop accidentally leads his team into a trap from which he is the only survivor. Drowning his guilt in booze, he is eventually assigned a new younger partner who turns out to have his own secrets."
Mean Girls,2004,7,360449,97,Comedy,NA,25013848.6,35949601.57,189874049.3,0,0,7,25,Mark Waters,"Lindsay Lohan,Rachel McAdams,Tina Fey,Tim Meadows,Amy Poehler","Cady Heron is a hit with The Plastics, the A-list girl clique at her new school, until she makes the mistake of falling for Aaron Samuels, the ex-boyfriend of alpha Plastic Regina George."
Jurassic World,2015,7,606959,124,Action,Adventure,175903838.1,244865495.4,1933599327,0,0,15,58,Colin Trevorrow,"Chris Pratt,Bryce Dallas Howard,Irfan Khan,Vincent D'Onofrio,Ty Simpkins","A new theme park, built on the original site of Jurassic Park, creates a genetically modified hybrid dinosaur, the Indominus Rex, which escapes containment and goes on a killing spree."
Harold & Kumar Get the Munchies,2004,7,190436,88,Adventure,Comedy,13242625.73,8063843.856,NA,0,0,3,3,Danny Leiner,"John Cho,Ethan Embry,Rob Tinkler,Fred Willard,Kal Penn",A Korean-American office worker and his Indian-American stoner friend embark on a quest to satisfy their desire for White Castle burgers.
Latter Days,2003,7,17485,107,Comedy,Drama,1283998.913,51293.4907,NA,0,0,3,0,C. Jay Cox,"Steve Sandvoss,Wes Ramsey,Rebekah Johnson,Amber Benson,Khary Payton","A promiscuous gay party animal falls for a young Mormon missionary, leading to crisis, cliché, and catastrophe."
Unleashed,2005,7,101338,103,Action,Crime,64043317.97,942585.2844,37022119.98,0,0,1,1,Louis Leterrier,"Jet Li,Morgan Freeman,Bob Hoskins,Kerry Condon,Vincent Regan",A man enslaved by the mob since childhood and raised into behaving like a human attack dog escapes his captors and attempts to start a new life.
Underworld,2003,7,262623,121,Action,Fantasy,33232913.04,32860944.6,144575946.8,0,0,110,10,Len Wiseman,"Kate Beckinsale,Scott Speedman,Michael Sheen,Shane Brolly,Bill Nighy","Selene, a vampire warrior, is entrenched in a conflict between vampires and werewolves, while falling in love with Michael, a human who is sought by werewolves for unknown reasons."
The Italian Job,2003,7,355933,111,Action,Crime,90635217.39,29392916.41,265969303.7,0,0,7,9,F. Gary Gray,"Mark Wahlberg,Charlize Theron,Donald Sutherland,Jason Statham,Seth Green","After being betrayed and left for dead in Italy, Charlie Croker and his team plan an elaborate gold heist against their former ally."
Bad Santa,2003,7,139637,92,Comedy,Crime,34743500,596944.69,116537298.8,0,0,112,12,Terry Zwigoff,"Billy Bob Thornton,Tony Cox,Brett Kelly,Lauren Graham,Lauren Tom",A miserable conman and his partner pose as Santa and his Little Helper to rob department stores on Christmas Eve. But they run into problems when the conman befriends a troubled kid.
The Lost Skeleton of Cadavra,2001,7,4850,90,Comedy,Horror,62777.63975,16361.42236,NA,0,0,2,2,Larry Blamire,"Fay Masterson,Andrew Parks,Susan McConnell,Brian Howe,Jennifer Blaire","A bad scientist and wife, a mad scientist and skeleton, two aliens and their escaped pet are all searching for the elusive element ""atmospherium""."
Ichi the Killer,2001,7,54678,129,Action,Comedy,2197217.391,NA,NA,0,0,6,4,Takashi Miike,"Tadanobu Asano,Nao Ômori,Shin'ya Tsukamoto,Paulyn Sun,Susumu Terajima","As sadomasochistic yakuza enforcer Kakihara searches for his missing boss he comes across Ichi, a repressed and psychotic killer who may be able to inflict levels of pain that Kakihara has only dreamed of achieving."
Monster's Ball,2001,7,87253,111,Drama,Romance,6277763.975,209062.0959,NA,1,0,14,23,Marc Forster,"Billy Bob Thornton,Taylor Simpson,Gabrielle Witcher,Heath Ledger,Amber Rules","After a family tragedy, a racist prison guard re-examines his attitudes while falling in love with the African-American wife of the last prisoner he executed."
