name,year,rating,imdb_votes,run_time,genre1,genre2,budget_USD,openning_USD,gross_USD,Oscar_wins,Oscar_nominations,other_wins,other_nominations,director,cast,synopsis
The Salute of the Jugger,1989,6.5,6832,90,Action,Sci-Fi,16047540.72,NA,NA,0,0,0,0,David Webb Peoples,"Rutger Hauer,Delroy Lindo,Anna Katarina,Vincent D'Onofrio,Gandhi MacIntyre","In a future where most of mankind and technology is wiped out, six people travel from place to place playing a brutal form of football with a dog skull. They hope one day to play in the league in a city."
The Secret of My Success,1987,6.5,32863,111,Comedy,Romance,29360704.23,19002375,271578877.9,0,0,NA,1,Herbert Ross,"Michael J. Fox,Helen Slater,Richard Jordan,Margaret Whitton,John Pankow","A talented young man can't get an executive position without rising through the ranks, so he comes up with a shortcut, which also benefits his love life."
Beverly Hills Cop II,1987,6.5,115436,100,Action,Comedy,68508309.86,64467677.51,733932058.3,0,1,NA,3,Tony Scott,"Eddie Murphy,Judge Reinhold,Jürgen Prochnow,Ronny Cox,John Ashton","Axel Foley returns to Beverly Hills to help Taggart and Rosewood investigate Chief Bogomil's near-fatal shooting and the series of ""alphabet crimes"" associated with it."
¡Three Amigos!,1986,6.5,72451,104,Comedy,Western,63400547.45,NA,NA,0,0,0,0,John Landis,"Steve Martin,Chevy Chase,Martin Short,Alfonso Arau,Tony Plana","Three actors accept an invitation to a Mexican village to perform their onscreen bandit fighter roles, unaware that it is the real thing."
Starchaser: The Legend of Orin,1985,6.5,2181,100,Animation,Action,38747397.77,NA,NA,0,0,0,0,Steven Hahn,"Joe Colligan,Carmen Argenziano,Noelle North,Anthony De Longis,Tyke Caravelli","Set on the subterranean Mine-World, a band of human worker are treated like slaves under the power of the evil overlord Zygon until one, Orin, unearths the hilt of a mythical sword that only he can master. Escaping the planet, he runs into...
    See more »"
Smooth Talk,1985,6.5,2561,92,Drama,Romance,6199583.643,NA,NA,0,0,NA,5,Joyce Chopra,"Treat Williams,Laura Dern,Mary Kay Place,Margaret Welsh,Sara Inglis",A free-spirited 15-year-old girl flirts with a dangerous stranger in the Northern California suburbs and must prepare herself for the frightening and traumatic consequences.
Rustlers' Rhapsody,1985,6.5,2259,88,Comedy,Western,6134934.902,NA,NA,0,0,NA,1,Hugh Wilson,"Tom Berenger,G.W. Bailey,Marilu Henner,Andy Griffith,Fernando Rey","A singing cowboy roams the Wild West with his sidekick, dancing horse and fancy wardrobe."
Rambo: First Blood Part II,1985,6.5,162778,96,Action,Adventure,113659033.5,65924417.01,775982335.3,0,1,NA,4,George P. Cosmatos,"Sylvester Stallone,Richard Crenna,Charles Napier,Steven Berkoff,Julia Nickson",Rambo returns to the jungles of Vietnam on a mission to infiltrate an enemy base-camp and rescue the American POWs still held captive there.
Explorers,1985,6.5,21364,109,Adventure,Comedy,64578996.28,9318335.858,NA,0,0,NA,5,Joe Dante,"Ethan Hawke,River Phoenix,Jason Presson,Bradley Gregg,Georg Olden","A boy obsessed with '50s sci-fi movies about aliens has a recurring dream about a blueprint of some kind, which he draws for his inventor friend. With the help of a third kid, they follow it and build themselves a spaceship. Now what?"
Purple Rain,1984,6.5,20867,111,Drama,Music,19261074.11,20775746.25,214011934.6,1,0,NA,4,Albert Magnoli,"Prince,Apollonia Kotero,Morris Day,Olga Karlatos,Clarence Williams III","A young musician, tormented by an abusive situation at home, must contend with a rival singer, a burgeoning romance, and his own dissatisfied band, as his star begins to rise."
Moscow on the Hudson,1984,6.5,11638,115,Comedy,Drama,34776939.36,NA,NA,0,0,NA,2,Paul Mazursky,"Robin Williams,Maria Conchita Alonso,Cleavant Derricks,Alejandro Rey,Saveliy Kramarov","A Russian saxophonist visiting New York with a circus troupe suddenly decides to defect from the USSR during a shopping trip to a department store, but he finds adjusting to American life more difficult than he imagined."
Johnny Dangerously,1984,6.5,14144,90,Comedy,Crime,24076342.64,NA,NA,0,0,0,0,Amy Heckerling,"Michael Keaton,Joe Piscopo,Marilu Henner,Maureen Stapleton,Peter Boyle","Set in the 1930s, an honest, good-hearted man is forced to turn to a life of crime to finance his neurotic mother's sky-rocketing medical bills."
Electric Dreams,1984,6.5,8681,95,Comedy,Drama,2700793.162,6601369.331,NA,0,0,NA,1,Steve Barron,"Lenny von Dohlen,Virginia Madsen,Maxwell Caulfield,Bud Cort,Don Fellows",An artificially intelligent PC and his human owner find themselves in a romantic rivalry over a woman.
Beat Street,1984,6.5,3754,105,Drama,Music,25413917.23,13959035.44,NA,0,0,0,0,Stan Lathan,"Rae Dawn Chong,Guy Davis,Jon Chardiet,Leon W. Grant,Saundra Santiago","An aspiring DJ, from the South Bronx, and his best friend, a promoter, try to get into show business by exposing people to hip-hop music and culture."
Twilight Zone: The Movie,1983,6.5,36783,101,Horror,Sci-Fi,27906425.7,18457309.96,NA,0,0,NA,8,Joe Dante,"Dan Aykroyd,Albert Brooks,Vic Morrow,Doug McGrath,Charles Hallahan","Four horror and science fiction segments, directed by four famous directors, each of them being a new version of a classic story from Rod Serling's landmark television series."
Rock & Rule,1983,6.5,3553,77,Animation,Fantasy,22325140.56,NA,NA,0,0,0,0,Clive Smith,"Don Francks,Paul Le Mat,Greg Salata,Susan Roman,Samantha Langevin","A malevolent rock star kidnaps a singer to force her to participate in the summoning of a demon, and her band must help her stop him."
Psycho II,1983,6.5,26372,113,Crime,Horror,13953212.85,23190920.68,NA,0,0,NA,2,Richard Franklin,"Anthony Perkins,Vera Miles,Meg Tilly,Robert Loggia,Dennis Franz","After twenty-two years of psychiatric care, Norman Bates attempts to return to a life of solitude, but the specters of his crimes - and his mother - continue to haunt him."
Octopussy,1983,6.5,102413,131,Action,Adventure,76742670.68,421947.9473,NA,0,0,NA,3,John Glen,"Roger Moore,Maud Adams,Louis Jourdan,Kristina Wayborn,Kabir Bedi","A fake Fabergé egg, and a fellow Agent's death, lead James Bond to uncover an international jewel-smuggling operation, headed by the mysterious Octopussy, being used to disguise a nuclear attack on N.A.T.O. forces."
Vigilante,1982,6.5,3470,90,Action,Crime,5760580.311,NA,NA,0,0,0,0,William Lustig,"Robert Forster,Fred Williamson,Richard Bright,Rutanya Alda,Don Blakely","After his wife and son got brutalized by a street gang, and a corrupt criminal justice system puts the perpetrators back on the street, a NYC factory worker teams up with a vigilante group to find some measure of bloody justice."
Halloween II,1981,6.5,85457,92,Horror,NA,7644334.433,23473720.71,78075617.66,0,0,NA,3,Rick Rosenthal,"Jamie Lee Curtis,Donald Pleasence,Charles Cyphers,Jeffrey Kramer,Lance Guest","While Dr. Loomis hunts for Michael Myers, a traumatized Laurie is rushed to Haddonfield Memorial Hospital, and The Shape is not far behind her."
Buddy Buddy,1981,6.5,4682,96,Comedy,NA,30577337.73,NA,NA,0,0,NA,2,Billy Wilder,"Jack Lemmon,Walter Matthau,Paula Prentiss,Klaus Kinski,Dana Elcar","During a high profile Mafia testimony case in California's Riverside County, a hired killer checks into a hotel room near the courthouse, while his depressed next-door neighbor wants to commit suicide due to marital problems."
Maniac,1980,6.5,16517,87,Crime,Drama,1180604.369,NA,NA,0,0,NA,1,William Lustig,"Joe Spinell,Caroline Munro,Abigail Clayton,Kelly Piper,Rita Montone",A psychopathic man goes on a killing and mutilation spree in New York City.
Flash Gordon,1980,6.5,54436,111,Action,Adventure,67463106.8,NA,NA,0,0,NA,10,Mike Hodges,"Sam J. Jones,Melody Anderson,Max von Sydow,Topol,Ornella Muti",A football player and his friends travel to the planet Mongo and find themselves fighting the tyranny of Ming the Merciless to save Earth.
Cruising,1980,6.5,22497,102,Crime,Drama,37104708.74,NA,NA,0,0,NA,5,William Friedkin,"Al Pacino,Paul Sorvino,Karen Allen,Richard Cox,Don Scardino",A police detective goes undercover in the underground S&M gay subculture of New York City to catch a serial killer who is preying on gay men.
Dracula,1979,6.5,9769,109,Drama,Horror,46569689.7,119585833,NA,0,0,NA,4,John Badham,"Frank Langella,Laurence Olivier,Donald Pleasence,Kate Nelligan,Trevor Eve","In 1913, the charming, seductive and sinister vampire Count Dracula travels to England in search of an immortal bride."
Wizards,1977,6.5,11380,82,Animation,Adventure,5503920.792,NA,NA,0,0,NA,3,Ralph Bakshi,"Bob Holt,Jesse Welles,Richard Romanus,David Proval,Jim Connell","On a post-apocalyptic Earth, a wizard and his faire folk comrades fight an evil wizard who's using technology in his bid for conquest."
The Kentucky Fried Movie,1977,6.5,18289,83,Comedy,NA,2981290.429,22933003.3,NA,0,0,0,0,John Landis,"Marilyn Joi,Saul Kahan,David Zucker,Marcy Goldman,Dulcie Jordan","A series of short, highly irreverent, and often tasteless skits."
"Alice, Sweet Alice",1976,6.5,10829,107,Crime,Drama,1660849.209,NA,NA,0,0,NA,3,Alfred Sole,"Linda Miller,Mildred Clinton,Paula E. Sheppard,Niles McMaster,Jane Lowry","In 1961, a divorced Catholic couple's life is turned upside down when one of their two adolescent daughters is suspected of her younger sister's brutal murder during her First Holy Communion, and a series of subsequent stabbings."
The Missouri Breaks,1976,6.5,10471,126,Drama,Western,48848506.15,NA,NA,0,0,0,0,Arthur Penn,"Marlon Brando,Jack Nicholson,Randy Quaid,Kathleen Lloyd,Frederic Forrest","Tom Logan is a horse thief. Rancher David Braxton has horses, and a daughter, worth stealing. But Braxton has just hired Lee Clayton, an infamous ""regulator"", to hunt down the horse thieves; one at a time."
A Boy and His Dog,1975,6.5,17461,91,Comedy,Drama,2066527.881,NA,NA,0,0,NA,2,L.Q. Jones,"Don Johnson,Susanne Benton,Jason Robards,Tim McIntire,Alvy Moore",A young man and his telepathic dog wander a post-apocalyptic wasteland.
Foxy Brown,1974,6.5,9995,92,Action,Crime,2818945.233,NA,NA,0,0,0,0,Jack Hill,"Pam Grier,Antonio Fargas,Peter Brown,Terry Carter,Kathryn Loder",A voluptuous black vigilante takes a job as a high-class prostitute to get revenge on the mobsters who murdered her boyfriend.
The Valachi Papers,1972,6.5,3520,110,Crime,Drama,33247368.42,NA,NA,0,0,0,0,Terence Young,"Charles Bronson,Lino Ventura,Jill Ireland,Walter Chiari,Joseph Wiseman",Gangster Joe Valachi is a marked man in the same joint where mob boss Don Vito Genovese is imprisoned and he's forced to co-operate with the DA in exchange for protection.
Angel Has Fallen,2019,6.4,90734,121,Action,Thriller,43487641.64,23245217.52,136995235.1,0,0,NA,1,Ric Roman Waugh,"Gerard Butler,Frederick Schmidt,Danny Huston,Rocci Williams,Piper Perabo",Mike Banning is framed for the attempted assassination of the President and must evade his own agency and the FBI as he tries to uncover the real threat.
Batman v Superman: Dawn of Justice,2016,6.4,670392,152,Action,Adventure,289520722.3,192250268.1,1011741651,0,0,NA,33,Zack Snyder,"Ben Affleck,Henry Cavill,Amy Adams,Jesse Eisenberg,Diane Lane","Fearing that the actions of Superman are left unchecked, Batman takes on the Man of Steel, while the world wrestles with what kind of a hero it really needs."
The Grinch,2018,6.4,62307,85,Animation,Adventure,83016801.6,566246920,NA,0,0,NA,18,Yarrow Cheney,"Benedict Cumberbatch,Cameron Seely,Rashida Jones,Pharrell Williams,Tristan O'Hare",A grumpy Grinch (Benedict Cumberbatch) plots to ruin Christmas for the village of Whoville.
Alien: Covenant,2017,6.4,268959,122,Horror,Sci-Fi,109990845.3,41003477.01,273153491.1,0,0,NA,13,Ridley Scott,"Michael Fassbender,Katherine Waterston,Billy Crudup,Danny McBride,Demián Bichir","The crew of a colony ship, bound for a remote planet, discover an uncharted paradise with a threat beyond their imagination, and must attempt a harrowing escape."
Muppets Most Wanted,2014,6.4,33581,107,Adventure,Comedy,58704210.6,19965449.96,94376543.88,0,0,NA,11,James Bobin,"Ricky Gervais,Ty Burrell,Tina Fey,Steve Whitmire,Eric Jacobson","While on a grand world tour, The Muppets find themselves wrapped into an European jewel-heist caper headed by a Kermit the Frog look-alike and his dastardly sidekick."
Say When,2014,6.4,43299,99,Comedy,Drama,5870421.06,81864.19576,NA,0,0,NA,1,Lynn Shelton,"Rocki DuCharme,Sara Lynne Wright,Larissa Schmitz,Phillip Abraham,Maura Lindsay","In the throes of a quarter-life crisis, Megan panics when her boyfriend proposes, then, taking an opportunity to escape for a week, hides out in the home of her new friend, 16-year-old Annika, who lives with her world-weary single dad."
Tomorrowland: A World Beyond,2015,6.4,178434,130,Action,Adventure,222811528.3,38666009,245273653.3,0,0,NA,19,Brad Bird,"George Clooney,Hugh Laurie,Britt Robertson,Raffey Cassidy,Tim McGraw","Bound by a shared destiny, a teen bursting with scientific curiosity and a former boy-genius inventor embark on a mission to unearth the secrets of a place somewhere in time and space that exists in their collective memory."
Step Up 4: Miami Heat,2012,6.4,55371,99,Drama,Music,39950016.12,14202482.54,200418686.5,0,0,NA,1,Scott Speer,"Cleopatra Coleman,Ryan Guzman,Misha Gabriel Hamilton,Michael 'Xeno' Langebeck,Stephen Boss","Emily arrives in Miami with aspirations to become a professional dancer. She sparks with Sean, the leader of a dance crew whose neighborhood is threatened by Emily's father's development plans."
John Dies at the End,2012,6.4,37579,99,Comedy,Fantasy,15092.63185,NA,NA,0,0,NA,6,Don Coscarelli,"Chase Williamson,Rob Mayes,Paul Giamatti,Clancy Brown,Glynn Turman","A new street drug that sends its users across time and dimensions has one drawback: some people return no longer human. Can two college drop-outs save humanity from this silent, otherworldly invasion?"
Colombiana,2011,6.4,98787,108,Action,Drama,49426377.82,2134387.923,89332323.35,0,0,NA,5,Olivier Megaton,"Zoe Saldana,Jordi Mollà,Lennie James,Amandla Stenberg,Michael Vartan",A young girl in Bogotá witnesses her parents' murder and grows up to be a stone-cold assassin.
The Dictator,2012,6.4,292222,83,Comedy,NA,78689425.68,21107036.56,217158037.4,0,0,NA,1,Larry Charles,"Sacha Baron Cohen,Sayed Badreya,Rocky Citron,Liam Campora,Aasif Mandvi",The heroic story of a dictator who risked his life to ensure that democracy would never come to the country he so lovingly oppressed.
The Woman in Black,2012,6.4,179507,95,Drama,Fantasy,20580311.33,5075856.561,154631665.5,0,0,NA,14,James Watkins,"Emma Shorey,Molly Harmon,Ellisa Walker-Reid,Sophie Stuckey,Daniel Radcliffe",A young solicitor travels to a remote village where he discovers that the vengeful ghost of a scorned woman is terrorizing the locals.
The Lorax,2012,6.4,106390,86,Animation,Adventure,84742458.43,85005244.79,422308371.1,0,0,NA,8,Chris Renaud,"Danny DeVito,Ed Helms,Zac Efron,Taylor Swift,Betty White","A 12-year-old boy searches for the one thing that will enable him to win the affection of the girl of his dreams. To find it he must discover the story of the Lorax, the grumpy yet charming creature who fights to protect his world."
Fright Night,2011,6.4,103655,106,Comedy,Horror,37069783.36,10026620.18,NA,0,0,NA,8,Craig Gillespie,"Anton Yelchin,Colin Farrell,Toni Collette,David Tennant,Imogen Poots","When a nice new neighbor moves in next door, Charley discovers that he is an ancient vampire who preys on the community. Can he save his neighborhood from the creature with the help of the famous ""vampire killer"", Peter Vincent?"
Riddick,2013,6.4,160720,119,Action,Adventure,45338942.38,117329182.9,NA,0,0,NA,2,David Twohy,"Vin Diesel,Jordi Mollà,Matt Nable,Katee Sackhoff,Dave Bautista","Left for dead on a sun-scorched planet, Riddick finds himself up against an alien race of predators. Activating an emergency beacon alerts two ships: one carrying a new breed of mercenary, the other captained by a man from Riddick's past."
Hot Tub Time Machine,2010,6.4,168894,101,Comedy,Sci-Fi,45887882.01,17871420.6,84109233.51,0,0,NA,5,Steve Pink,"John Cusack,Clark Duke,Craig Robinson,Rob Corddry,Sebastian Stan","A malfunctioning time machine at a ski resort takes a man back to 1986 with his two friends and nephew, where they must relive a fateful night and not change anything to make sure the nephew is born."
Alice in Wonderland,2010,6.4,399560,108,Adventure,Family,254932677.8,147989723.5,1307125382,2,0,NA,63,Tim Burton,"Johnny Depp,Mia Wasikowska,Helena Bonham Carter,Anne Hathaway,Crispin Glover","Nineteen-year-old Alice returns to the magical world from her childhood adventure, where she reunites with her old friends and learns of her true destiny: to end the Red Queen's reign of terror."
Salt,2010,6.4,306459,100,Action,Thriller,140212972.8,45902213.05,374117916.2,0,1,NA,15,Phillip Noyce,"Angelina Jolie,Liev Schreiber,Chiwetel Ejiofor,Daniel Olbrychski,August Diehl",A CIA agent goes on the run after a defector accuses her of being a Russian spy.
Monsters vs. Aliens,2009,6.4,155278,94,Animation,Action,226724993.8,76854713.7,494273273.8,0,0,NA,10,Rob Letterman,"Reese Witherspoon,Seth Rogen,Hugh Laurie,Will Arnett,Kiefer Sutherland",A woman transformed into a giant after she is struck by a meteorite on her wedding day becomes part of a team of monsters sent in by the U.S. government to defeat an alien mastermind trying to take over Earth.
Mamma Mia!,2008,6.4,230801,108,Comedy,Musical,67130026.06,35825797.39,787282403.5,0,0,NA,25,Phyllida Lloyd,"Amanda Seyfried,Stellan Skarsgård,Pierce Brosnan,Nancy Baldwin,Colin Firth",The story of a bride-to-be trying to find her real father told using hit songs by the popular 1970s group ABBA.
The Number 23,2007,6.4,198505,98,Crime,Mystery,42905624.7,19579535.34,104001645.4,0,0,NA,5,Joel Schumacher,"Jim Carrey,Virginia Madsen,Logan Lerman,Danny Huston,Lynn Collins","Walter Sparrow becomes obsessed with a novel that he believes was written about him, as more and more similarities between himself and his literary alter ego seem to arise."
The Hills Have Eyes,2006,6.4,165841,107,Horror,Thriller,20680654.76,21657487.57,97000285.28,0,0,NA,13,Alexandre Aja,"Maxime Giffard,Michael Bailey Smith,Tom Bower,Ted Levine,Kathleen Quinlan",A traveling family falls victim to a group of mutated cannibals in a desert far away from civilization.
Mr. Bean's Holiday,2007,6.4,121484,90,Comedy,Family,33520019.3,11482487.75,308030667.4,0,0,NA,2,Steve Bendelack,"Rowan Atkinson,Steve Pemberton,Lily Atkinson,Preston Nyman,Sharlit Deyzac","Mr. Bean wins a trip to Cannes where he unwittingly separates a young boy from his father and must help the two reunite. On the way he discovers France, bicycling, and true love."
Hancock,2008,6.4,463760,92,Action,Drama,193644305.9,80819231.32,806059587.1,0,0,NA,14,Peter Berg,"Will Smith,Charlize Theron,Jason Bateman,Jae Head,Eddie Marsan",Hancock is a superhero whose ill-considered behavior regularly causes damage in the millions. He changes when the person he saves helps him improve his public image.
Hoodwinked,2005,6.4,59726,80,Animation,Adventure,24905734.77,24022509.1,156569071.9,0,0,NA,1,Cory Edwards,"Anne Hathaway,Glenn Close,Jim Belushi,Patrick Warburton,Anthony Anderson","Little Red Riding Hood, the Wolf, the Woodsman, and Granny all tell the police the events that led up to their encounter."
Daybreakers,2009,6.4,126288,98,Action,Horror,25911427.87,66613699.9,NA,0,0,NA,6,Michael Spierig,"Harriet Minto-Day,Jay Laga'aia,Damien Garvey,Sahaj Dumpleton,Allan Todd","In the year 2019, a plague has transformed almost every human into vampires. Faced with a dwindling blood supply, the fractured dominant race plots their survival; meanwhile, a researcher works with a covert band of vamps on a way to save...
    See more »"
Godzilla: Final Wars,2004,6.4,8310,125,Action,Adventure,28692355.74,432548.2984,13488794.37,0,0,NA,3,Ryûhei Kitamura,"Masahiro Matsuoka,Rei Kikukawa,Don Frye,Maki Mizuno,Kazuki Kitamura","Godzilla's fiftieth Anniversary project, in which Godzilla travels around the world to fight his old foes and his allies plus a new, mysterious monster named Monster X."
The Longest Yard,2005,6.4,171158,113,Comedy,Crime,116701157.2,83417481.93,270861347.8,0,0,NA,17,Peter Segal,"Adam Sandler,Chris Rock,Burt Reynolds,Nelly,Michael Irvin",Prison inmates form a football team to challenge the prison guards.
Revolver,2005,6.4,93351,111,Action,Crime,1670743.578,NA,NA,0,0,NA,0,Guy Ritchie,"Jason Statham,Ray Liotta,Vincent Pastore,André 3000,Terence Maynard",Gambler Jake Green enters into a game with potentially deadly consequences.
Robots,2005,6.4,140558,91,Animation,Adventure,106738863.3,51299126.07,371050375.8,0,0,NA,22,Chris Wedge,"Paula Abdul,Halle Berry,Lucille Bliss,Terry Bradshaw,Jim Broadbent","In a robot world, a young idealistic inventor travels to the big city to join his inspiration's company, only to find himself opposing its sinister new management."
Ginger Snaps 2: Unleashed,2004,6.4,13649,94,Horror,Thriller,4027035.399,92473.25546,NA,0,0,NA,2,Brett Sullivan,"Emily Perkins,Brendan Fletcher,Katharine Isabelle,Tatiana Maslany,Susan Adam","Ginger's sister Brigitte, now a werewolf herself, must try to find a cure for her blood lust before the next full moon while hiding out in a rehab clinic from a relentless werewolf."
The Punisher,2004,6.4,155816,124,Action,Crime,48556294.34,20356162.58,NA,0,0,NA,5,Jonathan Hensleigh,"A. Russell Andrews,Omar Avila,James Carpinello,Mark Collie,Russell Durham Comegys",An undercover FBI agent becomes a vigilante and sets out to unleash his wrath upon the corrupt businessman who slaughtered his entire family at a reunion.
Mindhunters,2004,6.4,59809,106,Crime,Horror,39727877.18,404722.5989,34810538.59,0,0,NA,4,Renny Harlin,"Eion Bailey,Clifton Collins Jr.,Will Kemp,Val Kilmer,Jonny Lee Miller",Trainees in the FBI's psychological profiling program must put their training into practice when they discover a killer in their midst.
Little Secrets,2001,6.4,3255,96,Comedy,Drama,3923602.484,300935.6022,NA,0,0,NA,2,Blair Treu,"Evan Rachel Wood,Michael Angarano,David Gallagher,Vivica A. Fox,Jan Broberg","A fourteen-year-old aspiring violinist finds herself under an increasing amount of pressure to keep secrets for herself, her family and her newfound best friend."
Young Adam,2003,6.4,13785,98,Crime,Drama,8034988.76,459383.0888,NA,0,0,NA,17,David Mackenzie,"Ewan McGregor,Tilda Swinton,Peter Mullan,Emily Mortimer,Jack McElhone",A young drifter working on a river barge disrupts his employers' lives while hiding the fact that he knows more about a dead woman found in the river than he admits.
Once Upon a Time in Mexico,2003,6.4,158496,102,Action,Crime,43807021.74,35384167.12,148317859.5,0,0,NA,6,Robert Rodriguez,"Antonio Banderas,Salma Hayek,Johnny Depp,Mickey Rourke,Eva Mendes","Hitman ""El Mariachi"" becomes involved in international espionage involving a psychotic CIA agent and a corrupt Mexican general."
Van Wilder: Party Liaison,2002,6.4,107439,92,Comedy,Romance,9270083.38,1795295.333,NA,0,0,NA,2,Walt Becker,"Ryan Reynolds,Tara Reid,Tim Matheson,Kal Penn,Teck Holmes",The most popular kid on campus meets a beautiful journalist who makes him realize that maybe he's afraid to graduate.
Versus,2000,6.4,12975,119,Action,Drama,645639.9535,NA,NA,0,0,NA,0,Ryûhei Kitamura,"Tak Sakaguchi,Hideo Sakaki,Chieko Misaka,Kenji Matsuda,Yuichiro Arai",There are 666 portals that connect this world to the other side. These are concealed from all human beings. Somewhere in Japan exists the 444th portal.... The forest of resurrection.
Session 9,2001,6.4,57297,100,Horror,Mystery,2354161.491,120051.2499,NA,0,0,NA,3,Brad Anderson,"David Caruso,Stephen Gevedon,Paul Guilfoyle,Josh Lucas,Peter Mullan",Tensions rise within an asbestos cleaning crew as they work in an abandoned mental hospital with a horrific past that seems to be coming back.
Baby Boy,2001,6.4,14184,130,Crime,Drama,25111055.9,13507241.68,NA,0,0,NA,14,John Singleton,"Tyrese Gibson,Taraji P. Henson,Omar Gooding,Tamara Bass,Candy Ann Brown","In South Central L.A., a misguided 20-year-old African-American man, a ""baby boy"", faces the commitments of real life."
Star Trek: Nemesis,2002,6.4,77200,116,Action,Adventure,92700833.8,28603313.5,103999251.6,0,0,NA,4,Stuart Baird,"Patrick Stewart,Jonathan Frakes,Brent Spiner,LeVar Burton,Michael Dorn","The Enterprise is diverted to the Romulan homeworld Romulus, supposedly because they want to negotiate a peace treaty. Captain Picard and his crew discover a serious threat to the Federation once Praetor Shinzon plans to attack Earth."
American Pie 2,2001,6.4,248741,108,Comedy,NA,47083229.81,70810015.22,451298399.9,0,0,NA,6,J.B. Rogers,"Jason Biggs,Shannon Elizabeth,Alyson Hannigan,Chris Klein,Thomas Ian Nicholas","Jim and his friends are now in college, and they decide to meet up at the beach house for some fun."
Rat Race,2001,6.4,113135,112,Action,Adventure,75333167.7,18302968.4,134184904.2,0,0,NA,3,Jerry Zucker,"Breckin Meyer,Jenica Bergere,Cuba Gooding Jr.,Carrie Diamond,Douglas Haase","A Las Vegas casino magnate, determined to find a new avenue for wagering, sets up a race for money."
Crazy/Beautiful,2001,6.4,24512,99,Drama,Romance,20402732.92,7400008.452,NA,0,0,NA,5,John Stockwell,"Kirsten Dunst,Jay Hernandez,Bruce Davison,Herman Osorio,Miguel Castro","At Pacific Palisades High, a poor Latino falls hard for a troubled girl from an affluent neighborhood."
The Princess Diaries,2001,6.4,137231,115,Comedy,Family,40805465.84,35880982.18,89593417.75,0,0,NA,11,Garry Marshall,"Julie Andrews,Anne Hathaway,Hector Elizondo,Heather Matarazzo,Mandy Moore","Mia Thermopolis has just found out that she is the heir apparent to the throne of Genovia. With her friends Lilly and Michael Moscovitz in tow, she tries to navigate through the rest of her sixteenth year."
